id,hotel_id,date,national_id,negative_review,positive_review,score,trip_type,guests_composition_id,room_type_id,vacation_length
834,4,12/29/2015,200, Parking car is difficult, Very friendly staff excellent accommadation,7.5, Business trip,2,1,2
835,4,12/25/2015,200,No Negative, Great location Comfortable room ,9.6, Business trip,2,1,1
836,4,12/25/2015,200,No Negative, Breakfast was great Room was clean and spacious Staff very friendly and at hand to help Good location 10 mins walk from nearest tube,10, Leisure trip,2,1,4
837,4,12/23/2015,200, Owners getting preferential treatment in the clubhouse What s good for the goose , Great location great front of house staff,9.6, Leisure trip,2,2,2
838,4,12/22/2015,200,No Negative, Great location ,10, Leisure trip,2,1,3
839,4,12/22/2015,200,No Negative, Friendly staff good location great room,9.2, Leisure trip,2,1,2
840,4,12/17/2015,200, One sloppy breakfast staff member, Tranquility and good service,10, Leisure trip,2,1,1
841,4,12/15/2015,200, Lack of swimming pool , Rooms and location were great good quality hotel ,9.2, Leisure trip,2,1,1
842,4,12/13/2015,200,No Negative, Perfect location 5 mins from underground 10 mins walk from St Paul s Really clean hotel staff were friendly So quiet at night ,10, Leisure trip,2,1,2
843,4,12/10/2015,200,No Negative, The staff were terrific and the location and cleanliness of the hotel first class ,10, Leisure trip,2,1,3
844,4,12/06/2015,200, nothing, Great room spotlessly clean brilliant location very pleasant and helpful staff ,10, Leisure trip,4,1,1
846,4,12/01/2015,200, Nothing, Staff were so helpful and attentive Room had every comfort top quality linens toiletries etc Food was also excellent and very reasonable,9.6, Leisure trip,1,1,2
847,4,12/01/2015,200, Very small room and very expensive for a fairly average room , Good location in centre of London but very quiet ,5.4, Leisure trip,2,1,1
848,4,11/29/2015,200,No Negative, It was clean and comfortable and exactly where we needed to be but it was very expensive ,8.8, Leisure trip,2,3,1
849,4,11/26/2015,200, Absolutely nothing bad to say about this hotel , Everything It was smooth every step of the way ,10, Business trip,1,1,2
850,4,11/26/2015,200,No Negative, Staff were very friendly and helpful Room was clean comfortable and spacious,10, Leisure trip,2,1,2
851,4,11/24/2015,200,No Negative, Excellent location and very clean and tidy ,9.2, Leisure trip,2,1,2
852,4,11/23/2015,200, Nothing , Great location friendly staff good selection at breakfast Perfect,9.6, Leisure trip,2,1,1
853,4,11/18/2015,200,No Negative, all the staff were polite and attentative the hotel was spotlessly clean no traffic noise at night and in a good location ,10, Leisure trip,2,1,2
854,4,11/15/2015,200,No Negative, The helpfulness of staff ,9.6, Leisure trip,5,1,2
855,4,11/10/2015,200, None, Lovely hotel Great staff We have stayed here several times before I would not hesitate to recommend this hotel to anyone,9.6, Leisure trip,5,1,1
856,4,11/08/2015,200,No Negative, Being able to have breakfast in our room wearing a bathrobe and watching TV Room layout very good,10, Leisure trip,2,1,1
857,4,11/06/2015,200,No Negative, Access to the club room for free drinks and snacks,9.2, Leisure trip,2,1,1
858,4,11/02/2015,200, reception on arriving was slow and seemed disorganised , location,7.9, Business trip,1,1,1
859,4,11/01/2015,200,No Negative, Very comfortable room with excellent facilities The staff were very friendly helpful and welcoming ,9.6, Leisure trip,2,1,2
860,4,10/28/2015,200,No Negative, Fantastic service and brilliant location,9.6, Leisure trip,2,1,2
861,4,10/27/2015,200,No Negative, Beautifully designed hideaway in a great location,10, Business trip,2,2,2
863,4,10/20/2015,200, Nothing Will return , Lovely room no noise from adjoining rooms large modern bathroom with excellent shower ,9.6, Leisure trip,2,1,3
865,4,10/18/2015,200,No Negative, We love the Apex it is classy clean and convenient ,10, Leisure trip,2,2,1
866,4,10/12/2015,200,No Negative, first class bed,8.8, Leisure trip,2,1,1
867,4,10/12/2015,200, Lighting in lounge area too subdued to allow reading, Beds were fantastic rooms spacious location set back from street,8.8, Business trip,1,1,1
868,4,10/06/2015,200,No Negative, Great location very good staff Full Sky Sports package ,9.2, Leisure trip,2,1,3
869,4,9/23/2015,200, A little pricey as room wasn t that big , Stylish decor great staff Super food ,9.5, Business trip,1,1,2
870,4,9/21/2015,200,No Negative, Very helpful staff Early check in Quiet room Quiet air con,9.6, Leisure trip,2,1,2
871,4,9/15/2015,200, Nothing to dislike, Friendly staff great location quiet area in busy London,9.6, Leisure trip,2,1,3
872,4,09/08/2015,200, n a, location and hotel amentities,10, Leisure trip,2,1,2
873,4,09/02/2015,200, it rained on sunday , perfect location for the west end or city,10, Leisure trip,2,1,2
874,4,8/29/2015,200, restaurant table arrangement cramped,No Positive,7.5, Leisure trip,2,1,7
875,4,8/17/2015,200, Nothng to fault , The professionalism of the staff attentative but not too overbearing ,8.8, Leisure trip,2,1,3
876,4,08/11/2015,200, nothing Everything was great, Fantastic room Helpful friendly staff Can t fault,10, Leisure trip,2,1,1
877,4,08/09/2015,200, Nothing not liked, Very comfortable room and shower facilities,9.2, Leisure trip,2,1,1
878,4,5/22/2017,202, The Wi Fi was rather terrible My husband was able to get it to work on his phone but it did not work on mine And since I did not get an international plan for my phone for this trip I was relying on Wi Fi to communicate while in London Thankfully there were other locations around the city where I could connect to the Wi Fi , The location was excellent and within a decent walking distance from the Underground Tube We also went to a show and the hotel is on the edge of the theater district There were also many restaurants and shops nearby and while it was in a busy area the inside of the hotel itself was very quiet The bed was comfortable and the shower was nice The staff was also very helpful we arrived during some kind of system outage but they got us checked in and then let us know the next day that we could come back and check in properly They also got us taxis rather quickly when we needed them ,9.6, Leisure trip,2,1,2
879,4,5/16/2017,202, They don t have parking and there is no easy parking available nearby , Very comfortable room Spacious bathroom Excellent service Great location ,9.6, Leisure trip,3,1,3
880,4,11/04/2016,202, I didn t understand the continental breakfast setup My room didn t include breakfast A weetabix and pastry and tea ended up costing 18 pounds ,No Positive,9.6, Business trip,1,1,2
881,4,9/26/2016,202, The AC couldn t keep the room cool during the day even with the shades down About 1 3 of the TV channels didn t work due to weak signal Only one elevator bank for guests it s a walk from the higher number rooms There are other lifts but they re staff only , Great location The rooms and bathrooms are very well laid out with plenty of storage Elemis products shampoo conditioner bath gel and lotion Lovely coffee and tea service includes milk chocolate and different types of sugar Plenty of outlets Clever desk vanity set up is a perfect area to dry hair makeup The bench at the end of the bed is also very handy ,10, Leisure trip,1,1,2
882,4,09/10/2016,202,No Negative, Loved the courtyard nice place to unwind after sightseeing Lots of attention to comfort and details in our room towel warmer wash cloths usb ports lovely bedding cute rubber duckie cozy and comfortable public areas ,10, Leisure trip,4,1,4
883,4,08/09/2016,202, The coffee was a bit weak but this is a small shortcoming in context , This hotel offers a great value in a good location The staff was marvelous and helpful to a fault ,10, Business trip,1,1,3
884,4,5/27/2016,202, No FOX news or CNBC on TV these are important channels for US visitors Big selection of international channels from other countries Wish there was ice machine on floor for convenience, Great staff Love the location ,10, Leisure trip,2,1,5
885,4,5/19/2016,202, I sleep warm and I couldn t get the room cool enough but that s minor , Large room for London for sure And it s well located in the city The staff was attentive ,8.3, Leisure trip,2,1,5
886,4,3/27/2016,202, My one experience in the dining room was not great I ordered a cheese omelette server brought ham omelette horrifying this vegetarian , Quiet location in a courtyard off Fleet Street Spacious room with shower and full bathtub Extra comfortable and luxurious bedding friendly staff lively bar near the lobby Fifteen minutes walk from three different tube lines Fast reliable Internet Complimentary bottled water replenished each day ,10, Leisure trip,1,1,8
887,4,3/24/2016,202, All night menu could have had better quality choices , Arrived late and had dinner and drinks at the lively bar lounge area Great room with stellar bathroom and toiletries The free coffee and hot cocoa in the room was replenished daily with a few complementary cookies as well Fast free wifi Loved the stay ,9.2, Leisure trip,5,1,4
888,4,3/23/2016,202,No Negative, We stayed at the Apex after a conference I had in London last week The staff at the front desk and the lounge were extremely friendly and helpful The hotel was very modern very clean and very quiet We had a very comfortable stay and will definitely be looking to return to the Apex should our travels take us back to London in the near future ,10, Leisure trip,2,1,2
889,4,10/05/2015,202, Very few cons Entry from street was how we entered initially Not best with luggage Rear court entry hard to find was better Some cabs knew some did not Also lack of hooks in entry or bath made for sleek look at some loss of function , Many pros Very pleased here Modern clean Large room and bath Excellent stay Helpful staff Usually stay west of here but this location turned out to be perfect for this trip ,9.6, Leisure trip,2,1,4
890,4,09/01/2015,202, The only issue we had was finding the hotel via our taxi drivers Do a little research on the location beforehand to help your taxi driver out , The staff as incredibly helpful and attentive and the concierge is able to book tickets to attractions for us which made the whole process so easy We had a package for free breakfast our first night and the breakfast was amazing The location of this hotel is incredible It s located on a small side street that is very quiet but off of the main road in London Fleet St Couldn t have imagined a better place to stay in London ,10, Leisure trip,5,1,3
891,4,08/03/2017,202, I believe daily rate differentials should be advised to customers not after the fact, Great Hotel with wonderful staff and good cuisine ,7.9, Leisure trip,2,1,3
892,4,07/11/2017,202, Breakfast service a little spotty perhaps understaffed ,No Positive,9.6, Business trip,1,1,4
894,4,8/31/2016,202, Hotel address was hard to find with a GPS, Very clean and staff was very helpful First time in London and would use it again,10, Leisure trip,4,1,4
895,4,3/17/2016,202, iron in the room, quaint lounge bar excellent location ,10, Business trip,2,1,3
896,4,10/18/2015,202,No Negative, Staff,9.6, Business trip,2,1,6
898,5,9/30/2016,1, The double room was so small there was no room to store bags Two people were unable to dress at the same time The walk in wet room was so small that when you turned on the shower it would completely soak the whole bathroom so no one else was able to use Friends staying in a suit were meant to of received complimentary soft drinks fruit and dressing gowns which were not provided The gym smelt as if it was being used as a smoking room Very disappointed in what appeared to be a lovely hotel with reasonable star rating , The only plus was the location being fairly central ,3.8, Leisure trip,4,4,2
899,5,10/28/2015,10, May be the Restaurant Bar must extend the close hours , Very Friendly Staff specially Lucia who helps us with all our req Great Location Comfortable Rooms ,8.8, Leisure trip,5,3,5
900,5,07/03/2017,13, Tiny rooms v small shower cramped space for suitcase, I expected a budget room to be small but this really was v small cramped Not enough space for suitcase shower area adequate Hidden wardrobe drop down desk useful Bed however very comfortable indeed Staff exceptionally helpful which made up for the minute sized room ,7.5, Leisure trip,1,4,1
901,5,06/11/2017,13, The staff here are indifferent and the hotel didn t respond to communication in the lead up to my stay I arrived 4 hours prior to check in time and had emailed twice in the week leading up to staying to ask for an early check in even offering to pay for it after a 30 hour journey from Australia I didn t receive a response and my room was not ready until 2 hours after their advertised check in time I was offered a toilet off reception to use to change and told they would store my bags The toilet floor was covered in urine It was a disgusting and disappointing start to my trip that coloured my view of the hotel , The rooms have been renovated to look quite nice and are representative of the photos but they re not at all functional to stay in They ve placed extra furniture items in the room in an attempt to correct this but that just makes the spaces cluttered and not all of the additional items are functional either i e additional robe placed in dark entrance mostly filled up by the ironing board hard to see into damp smell emanating from it and makes accessing room awkward I ended up checking out after one night as I was there for 5 days and had work commitments so ease of use with the room was important to me ,4.2, Business trip,1,4,5
902,5,06/09/2017,13, Very restricted in bathroom too small and did not like the overhead shower , Staff in Restaurant were very helpful at Breakfast with Gluten Free Diet Selection of food was very good ,9.2, Leisure trip,2,3,1
903,5,5/26/2017,13, paying at arrival cause when something goes wrong like there was no hot water next morning you cant just move somewhere else quickly , location is nice and surrounding is also pretty comfortable to find aynthing,7.9, Business trip,4,4,2
904,5,1/31/2017,13, Older style hotel room with dated furnishings Not very spacious for those travelling with larger bags , Location location Right off Oxford Street London s iconic shopping destination ,6.7, Leisure trip,1,4,7
905,5,10/26/2016,13, Buffet breakfast was a bit expensive Rooms were a bit tiny but manageable, Conveniently located Close to tube station Staff were helpful friendly and nice Rooms were a little small but comfortable Ideal location for Central London Very close to a laundromat ideal for travelers Would definitely stay here again ,8.3, Leisure trip,2,4,6
906,5,10/24/2016,13, Originally placed in the basement which is totally depressing without a window however I did ask to be moved and they happily obliged , Lovely room friendly staff ,10, Leisure trip,1,3,2
907,5,10/02/2016,13, Room was too small for 2 people A double bed with 2 mattresses does not pass as a twin Overpaid for what I got , Staff were friendly and efficient Room was clean Nearby facilities were reasonable ,5.8, Leisure trip,5,3,2
908,5,09/09/2016,13, no refrigerator in the room you can ask the staff to put your food in the kitchen refrigerator Very small room I think the bedsheets were not changed everyday, close to underground station staff was nice and helpful free printing which was useful free wifi free 3G phone in room you can use Google maps,4.2, Leisure trip,2,4,3
909,5,09/08/2016,13, Would like to have had a bit longer for check out but this didn t really cause us too much of a problem , The location for us could not have been any better the breakfast and staff were also excellent Complimentary wine was perfect after a very hard day ,8.8, Leisure trip,2,4,2
910,5,6/23/2016,13,No Negative, I picked this as a stop over for the Heathrow Express as reasonably close to Paddington and the Underground Quiet and comfortable and much better ambiance and value than the converted properties in Bloomsbury around the BM where I stayed before Good choice Lots of wonderful eateries nearby ,9.6, Leisure trip,1,4,1
911,5,5/24/2016,13, The most expensive and also the smallest room with minimal facilities that we stayed in for over a month in Europe but hey that s London Consistent with most other hotels in this area for the price , Good location with easy access to Paddington Station and other tube stations and bus routes nearby Short walk to Hyde Park Staff were very eager to please and helpful with extra tea coffee items in room umbrella loan taxi s etc Have stayed in this area several times before and this is a good hotel consistent with others in the area for the size of room and price A bit quieter than those closer to Bayswater Road Some really nice little pubs cafe s and restaurants around the area away from Paddington central ,6.7, Leisure trip,2,4,5
913,5,11/14/2015,13, Everything were good only the bathroom is to small and the shower water doesn t go to the drainage straight away so it is wet everywhere and the cupboard is not functional hard to reach , The location is close to the underground nice neighbourhood the receptionist was very friendly and helpful Good value for money ,7.1, Leisure trip,2,4,3
914,5,9/24/2015,13, We had to change rooms as the ac did not work and they did not fix it Staff could hardly understand English and I thought I was in London but English is not the language ,No Positive,4.2, Leisure trip,2,4,4
915,5,7/17/2017,13, No lift was a bit of a disappointment, Good location clean facilities helpful staff,7.9, Business trip,3,4,1
916,5,6/29/2017,13, Tiny bathroom Very awkward , The room was very small The bathroom ridiculously tiny Images on website are not accurate at all ,5, Leisure trip,2,4,1
917,5,03/05/2017,13,No Negative, Position and quietness,8.3, Business trip,1,4,1
918,5,12/25/2016,13, requesting some sandwiches and waiting 40 minutes gave up evening meal was awful soup came after main course, the breakfast really good,8.3, Leisure trip,2,4,3
919,5,10/21/2016,13, the coffee, excellent breakfast,9.6, Leisure trip,4,5,2
920,5,10/12/2016,13,No Negative, Staff were so friendly and efficient Great location Fabulous breakfast Club room very spacious and modern,10, Leisure trip,2,4,1
921,5,9/26/2016,13,No Negative, Good location,7.5, Leisure trip,2,4,3
922,5,08/11/2016,13, Room a little tight but acceptable Pillows a little hard ,No Positive,7.9, Leisure trip,2,4,6
923,5,7/13/2016,13, The food from the menu was not very good, breakfast was good,6.3, Leisure trip,2,4,2
924,5,06/03/2016,13, Only problem was a noisy air conditioner , Friendly staff Superb Breakfast Ideal location ,8.8, Leisure trip,5,3,3
925,5,12/23/2015,13,No Negative, late checkout easily granted Good bathroom,8.8, Leisure trip,1,4,2
926,5,9/30/2015,13, Small room and shower , Staff and location ,7.5, Leisure trip,1,4,3
927,5,11/02/2016,14, Compact double is a very small room tight wardrobe space safe not big enough for laptop no mini bar and or complimentary drinking water Certain furniture fixtures looked quite used and could do with replacement refurbishment All in all a pleasant hotel though , Friendly staff good location only a short walk to paddington station and easy check in out Comfortable bed and nice decor throughout Also got upgraded to a 5 Star Hotel for the first night as there was a maintenance issue in the hotel this was taken care of very professionally ,7.1, Business trip,1,4,7
928,5,8/25/2015,14, A room with a broken and leaking shower should not be given to guests Neither the reservation system nor the receptionists do understand that a female guest s family name can consist of two parts like maiden name plus husband s name while the respective husband has just one name This lead to the problem that an important parcel has not been accepted for which my husband was eagerly waiting Instead it was sent back by the receptionist , We had the benefit of being upgraded because of a broken shower in the room originally booked Excellent indian restaurant very friendly and normally helpful staff good continental breakfast for a good price Large number of staff Lot of storage room due to clever use of space ,8.8, Leisure trip,2,4,3
929,5,11/04/2015,14, room was in the basement just translucent window loud A C that still made loud sound when turned off , Location,5.8, Leisure trip,5,3,3
930,5,8/24/2015,17, nothing, the staff were very friendly attentive and responsive the hotel was perfectly located the house keeping were super in cleaning and responding to my requests,7.9, Leisure trip,4,4,4
931,5,3/21/2016,17,No Negative, professional staff very clean and comfortable room ,10, Leisure trip,2,4,3
932,5,10/03/2016,18, no power connection for the shaver at the toilet and was very inflexible for late check out even agreeing to pay for the same, staff was very helpful ,7.1, Business trip,4,4,2
933,5,12/20/2015,18,No Negative, Friendly staff,7.5, Business trip,1,4,6
934,5,7/14/2017,20, Our rooms were in underground floor it s nothing specifically bad but was not mentioned during booking Unstable wi fi signal in the room but still working The worst part is tiny bathroom It combines toilet and shower on a very small patch and if you are not alone after one person takes a shower everything around like floor toilet is absolutely wet , Hyde Park and public transport are in close proximity we used Bayswater station everyday Staff is really helpful supported us in printing boarding passes The pub across the street is great The room is small but probably good for value because of price and location ,7.9, Leisure trip,2,4,4
935,5,5/18/2016,21, The room was in the basement, The comfort of the room despite it was in the basement,8, Business trip,1,4,2
936,5,2/28/2016,21, Poor finishing of the room should be better for a 4 star hotel , Good breakfast friendly staff ,6.3, Leisure trip,2,4,2
937,5,11/08/2016,28,No Negative, Comfortable and very clean room,7.1, Business trip,1,4,7
938,5,6/21/2016,32, room was on the ground floor named club room indeed good in size but with strange dispositioning of wardrobe hairdryer , Location polite good staff especially at breakfas very good bed,7.9, Leisure trip,5,4,2
939,5,07/10/2017,32, Very small room Window cannot be open Very small bathroom ,No Positive,4.2, Leisure trip,2,3,6
940,5,12/18/2016,36, Tiny bathroom with no counter space , Great location close to many restaurants Hyde Park and the Tube Friendly and helpful staff We were upgraded to a Club Room free ,9.2, Leisure trip,3,3,1
941,5,12/16/2016,36, The size of the bathroom is very tiny especially in the standard room , The location was excellent for travelling by the underground The staff were very helpful and accommodating to our requests ,8.3, Leisure trip,3,3,3
942,5,8/18/2016,36, Wish we could have stayed a bit longer , During a rare London Heat Wave in July the air conditioning EXCEPTIONALLY good Newly renovated rooms with spa bathrooms Breakfast was the best offering we had ,10, Leisure trip,2,4,2
943,5,7/26/2016,36, A C in lobby was not operational during check in but not the fault of staff Felt badly for them as we were soon ensconced in our a c room , Staff were extremely pleasant and accommodating We were first given a room on the first floor room starting with 1 basement requested a higher floor and were moved on night two to a room on the second floor starting with a 4 for the rest of our stay They were apologetic for not being able to move us on the first night but it was not an issue as we were wiped out from traveling and the beds were extremely comfy First room was nice but very small although the loo was sizeable Second room was more spacious and equally as clean We happened to visit during a warm spell July 20 25 16 and they provided us with ice promptly every evening upon our return Great perk to have a real kettle in the room Good water pressure in the shower mini shampoo etc provided if you forget don t want to bring your own We brought our own power converter but underestimated usage The lovely ladies at the front desk handed over an extra no deposit required Bellman so sorry I cannot remember his name from Bulgaria was so incredibly nice He truly went above and beyond Location an easy walk to both Lancaster Gate tube and Paddington Station A bit off the beaten track which was nice because it was very quiet ,9.6, Leisure trip,5,3,5
945,5,6/15/2016,36, The breakfast buffet was ample but not high quality products I would suggest going elsewhere for a good English breakfast , I was actually moved to the Paddington Court location a block away from the London Paddington still Park Grand chain I appreciated a modern comfortable well designed room that met all my needs even though it was tiny that s just London Short walk to either Paddington or Lancaster Gate stations in a very nice neighbourhood away from the tacky side of Paddington I would definitely return here in the future ,9.2, Business trip,1,4,2
946,5,5/31/2016,36, The people behind the desk really ought to be able to read the details of a booking properly to avoid guests being misdirected to a considerably smaller room This took too much time to correct , When my daughter and her friend finally were given the correct room the one that I had reserved and paid for that was a relief ,6.7, Leisure trip,2,4,2
