id,hotel_id,date,national_id,negative_review,positive_review,score,trip_type,guests_composition_id,room_type_id,vacation_length
1,1,12/08/2016,13, The fact that there was no WIFI in my room In a Hotel this class I would expect that not only in the Bar and Restaurant area , The bed was extremely comfortable,10, Business trip,1,1,8
9,1,12/14/2016,77, The breakfast in the lounge is very moderate , The location was perfect just opposite big ben and under london eye Big hotel and very friendly and helpfull staff Also very clean,9.2, Leisure trip,2,2,4
11,1,10/17/2016,93, Scaffolding outside our bedroom window which workmen were noisily working on in particular on one of our three mornings not good enough for a 5 hotel We got a complimentary breakfast for the inconvenience I was glad we paid for room only in the hotel and not b b as I thought the breakfast for a five star hotel was poor We would probably stay in the Premier Inn County Hall if we were to visit London again as it is just around the corner and better value Pillows uncomfortable air con difficult to control room either too warm or too cold Could not locate steam room sauna, Location is excellent quiet room Decor in room excellent All staff excellent in particular all at reception desk concierge Hotel in general very clean ,8.3, Leisure trip,2,1,3
16,1,8/30/2016,139, Wi fi was a problem Miserable supply of milk soap etc, The bar and restaurant staff were wonderful ,7.5, Leisure trip,2,1,3
17,1,8/30/2016,143, breakfast should have more choices the options were very disappointing considering its a 5 star establishment , The location of this place is the best thing you need to have a nice trip in London everything is close by ,9.2, Leisure trip,2,1,5
28,1,3/23/2017,200,No Negative, Every member of staff went above and beyond to ensure that our stay at the Marriott County Hall was absolutely fantastic When I mentioned at check in that my husband and I were spending a last night together before he went away for four months work we were asked to wait in the stunning bar for ten minutes and when we went up to our room there were rose petals on the bed and complimentary champagne in an ice bucket plus a box of chocolate truffles Incredible service and such a lovely surprise The room itself was perfect the bed sumptuous and everything had been recently renovated in a luxurious modern style that still managed to echo and complement the history of the building Little touches like being able to easily link our laptop to the TV and watch movies from our own Netflix account was a huge bonus The hotel and amenities were beautiful but it was the wonderful friendly service where nothing was too much trouble that made our stay so memorable I hope we ll be back soon ,10, Leisure trip,2,1,1
31,1,02/08/2017,200, Would prefer crispy bacon , Lovely room with 2 double beds Bathroom was sumptuous with Floris soaps body lotion and bath shower shampoo conditioner They were really impressive and I ve brought home the opened products When we arrived in reception I asked for a room not too far down the corridor as I have mobility problems and my request was fulfilled Thank you That meant a lot ,9.6, Leisure trip,2,1,1
32,1,1/23/2017,200, its worth paying for the gallery breakfast in the main restaurant looked crowded where the gallery was relaxed and spacious , fantastic view over the Thames gallery for evening drinks and breakfast was lovely with a feeling of exclusiveness all the staff were very friendly polite and professional ,10, Leisure trip,2,2,1
35,1,01/01/2017,200, The room was not as described by booking com Clearly said a bath and only a shower was provided The bed was described as being over 180cm and this was not the case When challenged at the hotel I was informed that booking com only listed facilities available ,No Positive,7.5, Leisure trip,2,1,1
38,1,9/20/2016,200, The hotel is very overpriced for what you get Room service was also very poor took over an hour for the food to turn up and was stone cold when delivered When complaining we were initially told we d get a 60 discount with it only being by luck we noticed if food takes more than 45 mins it should be completely free ,No Positive,5, Leisure trip,2,1,1
39,1,9/18/2016,200,No Negative, We loved everything the history of the place and the fact that a lot of the original d cor is the same The staff were absolutely outstanding friendly and efficient the room had everything you could possibly need Maybe a bit pricey but for that location it s priceless ,9.2, Leisure trip,2,1,1
42,1,6/28/2016,200, I booked a room with a bath through booking com however on arrival my room had an assisted bathroom with no bath and just a shower hose no holder Second room was another assisted bathroom with a hospital esque wet room Paid a premium to have a hotel with a tub no tub Paid a premium to have a hotel with spa but no treatments available Paid a premium for a hotel with pool gym steam room Jacuzzi sauna but steam room and Jacuzzi were broken on day of visit Therefore I must regrettably leave a poor review , Excellent friendly staff familiar Marriott Hotels feel super clean well decorated and furnished ,6.7, Leisure trip,2,1,1
47,1,05/11/2016,200, Room not ready on arrival No price differential between Children s and adult breakfast Very expensive Had to insist to be moved from our breakfast table Glass on the floor under the table and around us had not been properly cleared from night before A problem for people with children I would propose , Unbeatable location for the Southbank area Great room better views Loved the small touch of a toy car in the room as a token apology ,8.3, Leisure trip,3,1,1
48,1,05/04/2016,200, Poor quality hotel could be magnificent but wasn t Staff were very mixed Some were terrific others reception person particularly were poor Felt no personal attention at all Very mediocre hotel indeed Unbelievable noise of drilling in the night as refurbishment still continued at 2am until complained Only good view of the sights of london if you pay extra Some rooms directly in front of London Eye with clunking noise whenever it was on , Location for the sights of London is great ,5.4, Business trip,4,1,1
57,1,2/28/2017,200, Booking com didn t mention that the parking was an additional charge , lovely room great view staff are helpfull and friendly ,9.6, Leisure trip,2,1,1
59,1,9/18/2016,200,No Negative, The room was perfect ,10, Leisure trip,1,1,1
61,1,8/18/2016,200, the food wasn t that great and was very expensive, the staff were very attentive and it was comfortable,9.2, Business trip,1,1,1
67,1,11/17/2015,200,No Negative, Very stylish and in a fantastic location,9.6, Leisure trip,3,1,1
71,1,05/04/2017,202, The lounge staff were untrained They were friendly clean and polite but had no idea how to perform their job We practically had to tackle them to get them to bring our snacks and drinks They were visiting with each other when they had customers in the lounge waiting for them , The room size and furnishings and the other hotel amenities were outstanding ,9.2, Leisure trip,4,1,1
75,2,8/31/2016,13, it s a shame about all the construction going on because it looked like such a beautiful place but we couldn t see a lot , super comfy beds cozy rooms lovely staff pretty sweet location I love amsterdam ,9.2, Leisure trip,4,3,4
76,2,2/15/2016,13, Room could have done with a microwave our room had a small leak in the walls from where the rain would come through , The room was exactly as expected The bed was the most comfortable bed that we have ever slept on the shower was HUGE Easy check in and check out only a 5 minute walk to the grocery store staff were very friendly and public transport is only minutes walk from the hotel room or if you like walking everything you need to see is only a 30 45min walk ,9.2, Leisure trip,2,4,5
77,2,09/01/2015,13, floor tiles in bath room shower were slippery when wet Black coating on glass wall between bath bed room was obviously an attempt to darken the glass tint that was inadequate Hall way to rooms on 2nd floor was too dark gloomy Reception area stuffy too hot on day we checked in I question the 4 star rating, staff good location suited us,7.1, Leisure trip,2,4,1
78,2,8/26/2015,13,No Negative, This is an older building with a wonderful refurbishment Our bedroom and bathroom were state of the art and perfect The dining experience was also excellent We had a problem with one meal but it was fixed immediately Will go back ,10, Leisure trip,2,4,2
79,2,1/15/2016,13, A lot of renovation work, Nice rooms and modern place,10, Leisure trip,2,4,3
80,2,4/26/2016,21, the club sandwiches cold bacon with congealed fat and processed chicken Very poor , The friendly staff in bar restaurant The evening meal was excellent A pity the club sandwiches at lunch were awful After the building renovations I think this hotel will be fabulous It has so much history and is so unusual Loved it ,9.6, Leisure trip,2,4,1
81,2,08/02/2016,21, Curtains had holes in it Door of the mini bar was broken , Place is very nice,6.3, Business trip,1,3,1
82,2,2/22/2016,21, There is no enough space in the room my room even to put your clothes , The architecture the bar area the staff are kind and helpful ,5.5, Business trip,1,4,2
83,2,4/19/2017,36, Staff a few were friendly and willing enough to help but we ran into one gentleman who seemed to be in training and was totally ineffective Every question we asked had to be referred to someone else he wouldn t make eye contact he wouldn t even just say I don t know the answer let me find out for you There didn t seem to be a manager around Unfortunately there is still a lot of construction going on so it is difficult to see what the building will be like when finished The temporary reception area is in a very small dark area under the central staircase too bad Breakfast was overpriced for a good but ordinary buffet , Location on the park with easy access to tram lines was very good ,6.3, Leisure trip,2,3,3
84,2,7/27/2016,36, The front desk staff particularly the young men tended to be a bit spaced out and were not very helpful at times however the female attendants on the desk were quite efficient and knowledgeable Breakfast was a bit pricey especially for two people combined , The rooms were comfortable and clean and the bed accommodated sleep well Restaurant and bar staff were very helpful and friendly The breakfast was quite good where there was a variety of selections available to choose from ,7.1, Business trip,2,1,5
85,2,6/16/2016,36, The hotel gardens and patios were under major renovation The sidewalk entrance was a mess There was no mention of this at all on the booking com website We were given a voucher for one drink cocktails excluded as compensation Not good enough , The location of this hotel is great It s very close to the tram lines and subway The staff was very helpful in getting us a room that was to our liking The breakfast buffet was fine ,7.5, Leisure trip,2,4,2
86,2,12/22/2015,40, the restaurant food was terrible my first room was facing the garden construction site which starts at 6am in the morning although per local law is not allowed when I reach the staff he said he could do nothing about it while the construction is actually owned by the hotel it s a real bazaar they can t control it after my insisting they changed my room but the fridge safe and sink wasn t working I stayed there 14 days never again , nothing,3.1, Business trip,1,4,14
87,2,12/15/2016,53, The sink in the bathroom was very dirty when I got the room Unacceptable The room was freezing cold they could turn on the heating before the guests arrive , The location is really good the room was spacious and comfortable the bathroom as well ,7.1, Leisure trip,1,3,1
88,2,9/16/2015,53, Cleaning small rooms Too expensive, Excellent location when arriving in car,5.4, Leisure trip,2,4,4
89,2,10/11/2016,67, So lets start from the weird thing that happened in one of the rooms we were staying One person in our group got 220v electric chock which went through her hands It came from water boiler or lamp due to either a bad wireing faulty socket lamp or water boiler Luckily the rooms fuse discharged and cut the electricity in the room immediately The hotel covered doctor expences were very sorry about what had happened and send a fruit basket to a room They also let us have a late check out for free of charge Thats all of the compensation we had In my opinion the compensation was not that big for endangering a life of guest or what do you think The managemt had a chance to read and comment my review before i posted it The hotel management answered that this electric problem is now fixed but its still unclear if they checked other renovated rooms for faulty wireing too It anyway seems that the management does not worry about this that much since the management said that they did nor endanger any lives in the hotel Ofcource the managent was also very sorry in the answer about what had happened Some information gaps there seemed to be between the manager and the personnel since the cleaner came to ask us when are we leaving and the keys stopped working before the time we had been granted to leave Picture is from bathroom lamp that had nothing to do with the insident but such wireing was visible in the rooms, Anyways the staff was extremely friendly no complants there Location of the hotel is about 1km from the nearest metro station The rooms were tidy and the beds were good to sleep in However there where several small faulty details unfinished renovation in the room like lamp on the floor nails sticking out of floor which rips your sock etc so nothing major but adding them all together it makes this as a three star hotel in my opinnion ,4.2, Leisure trip,4,3,2
90,2,5/22/2017,68, Careful they are still renovating the building and start at 8am so it suits for business people but if you want a relaxing stay the noise can annoy you , Great hotel original concept style,8.3, Business trip,1,3,2
91,2,11/27/2016,68, Hotel under renovation , Breakfast,6.3, Business trip,1,3,2
92,2,4/25/2016,68, The receptioninst was rather cold , The duplex room design ,9.6, Business trip,1,3,2
94,2,4/18/2017,74, Several parts of the building outside are under construction at the moment and getting to the reception required a little search around Also the standard rooms are located towards a rather frequented street which gets very noisy when opening the windows This is rather necessary though due to the sleeping area on the first floor of the room being somewhat stuffy , The hotel is nicely localted directly within the park which is accessed when walking out of the building The building itself has great history and wonderful architecture The staff is very helpful and friendly when in need of anything ,7.5, Leisure trip,2,4,3
95,2,12/19/2016,74, The breakfast was rather average from quality and appearance and not that well organized The young gentlemen managing this were more interested in watching the young female guests This was nice to see but at the same time spoons butter coffee etc were out I would expect a better experience for that price , The building was fantastic All renovated areas were very stylish The receptionist was very friendly and gave us a warm start in this place ,6.7, Leisure trip,2,3,2
96,2,03/02/2016,74, I hate when the beds are two separate beds pushed together That may just be a European thing or maybe I got the reservation wrong either way I would still go back to this hotel, The place looked amazing and it was close enough to everything that walking was not a hassle,8.8, Leisure trip,2,4,2
97,2,9/18/2015,76,No Negative, The matress and pillows were exceptionally good Best sleep in terms of comfort ever I would be grateful to know your suppliers as would like to replicate this comfort in my own home ,9.6, Business trip,1,4,1
98,2,5/16/2017,87, There is an ongoing construction enlarging the hotel The hotel s restaurant is nice but overpriced The bathroom is not very practical , The hotel is located in a beautiful old monastery building which has a special mood combined with all modern features There is a big park just opposite to the hotel Public transportation and a nice bakery for breakfast are also close Good wifi all around the hotel ,9.2, Leisure trip,2,4,3
99,2,9/15/2015,88,No Negative, Great and beautiful hotel with wonderful staff ,8.8, Leisure trip,4,4,3
100,2,04/05/2017,89, Bathroom lighting could have been brighter The airconditioning of our room 303 could not be turned down lower than 23 degrees celcius The refrigerator in our room was not cooling there was no thermostat The toiletries were not replenished shampoo shower gel dispenser was empty and was not replenished on the second day either , The location of the hotel is super opening out to Oosterpark The staff was very helpful and friendly The bed was very comfortable The room was spacious enough for 2 people ,7.9, Leisure trip,3,1,2
101,2,08/03/2017,93,No Negative, No real complaints the hotel was great great location surroundings rooms amenities and service Two recommendations however firstly the staff upon check in are very confusing regarding deposit payments and the staff offer you upon checkout to refund your original payment and you can make a new one Bit confusing Secondly the on site restaurant is a bit lacking very well thought out and excellent quality food for anyone of a vegetarian or vegan background but even a wrap or toasted sandwich option would be great Aside from those minor minor things fantastic spot and will be back when i return to Amsterdam ,7.5, Leisure trip,2,4,4
102,2,6/30/2017,93, We did not like the fact that breakfast was not included although you could pay extra for this The room we stayed in was lacking in space a bit and the bathroom was very badly lit to use the mirror in there which meant getting ready for evening a bit tricky but only a small negative comment , We loved the location of this hotel The fact that it is set in a Park away from the busy centre of dam square was great The tram system was brilliant and easy to handle The hotel is lovely and the bed was comfy Staff were very friendly and helpful and familiarized themselves with us when they realized we travelled from Ireland ,7.5, Leisure trip,2,4,3
103,2,4/26/2017,93, not cleaned well lady pushing to pay during my breakfast poor signs for temporary reception during renovation, the building meeting rooms modern style of my room park,7.1, Business trip,4,4,1
104,2,9/19/2016,93, split level bedrooms although quirky are impractical 1 TV remote for both tv s but on differernt floors A C is located downstairs so very impractical to have to go downstairs to adjust The walls are also very thin not good sound proofing , beautiful surroundings great location Old world style of the hotel is really different,6.3, Business trip,1,4,2
105,2,04/05/2016,93, The hotel is currently under going renovations and while this wasnt a major problem work did start early on Mon morning , Staff were very friendly helpful The kitchen provided us a great meal the bar staff were nice and the breakfast bar was very impressive ,7.9, Leisure trip,2,4,3
106,2,12/31/2015,93, The hotel is being renovated and an extensive development is unfolding just outside During working hours the noise can be very disturbing The facilities look and sound rickety The A C is extremely loud and not very effective overall the room was too cold What s worse turning it off makes it possible to hear water flowing dropping through pipes in the walls Chinese water torture anyone The bathroom walls are transparent And I don t mean you can maybe make something out if you squint I mean Oh my word I didn t want to see that There is maybe one spot in the room where one does not have a complete view of whatever is happening inside the bathroom The staff didn t change the towels they simply re folded them 3 days in a row with no new towels The hotel is quite far from the center and there s little to do around it If you think you can walk think again and take the tram instead Or another hotel , Polite staff ,4.2, Leisure trip,2,4,3
107,2,11/24/2015,93, The toilet has glass walls no privacy The room was dirty after 3 days because the cleaners never hoovered the room the towels never changed the fridge was empty the room was very small I don t understand how this hotel has 4 stars The day of our check out we were forced to leave the hotel at 8 30 because they would cut the electricity and the hot water due to renovation in the hotel , The hall,4.6, Leisure trip,2,4,3
108,2,11/10/2015,93, Taxi from hotel to airport was extortionate price so we took the train Breakfast was nice but very expensive , Close to Tram Excellent room nice staff ,10, Leisure trip,2,4,4
109,2,10/22/2015,93,No Negative, This was our first time in Amsterdam and the staff were incredibly helpful They took special notice of the fact that is was my birthday and were so friendly ,10, Leisure trip,2,4,4
110,2,08/06/2015,93, A bit noisy You can hear a lot through the walls It s a shame the construction is still going on however there is minimal disruption from this and it sounds like it will be great when done , Friendly staff nice rooms comfy bed though pillows aren t as comfy as they look There are two trams that leave from close to the hotel and one goes directly to Central and both go to the main tourist hub Oosterpark right on your door step,8.8, Leisure trip,2,4,3
111,2,4/19/2016,93, A drawer in the bedroom would be great could not find the lounge, staff EXCELLENTbed VERY comfortable,7.1, Leisure trip,2,4,4
112,2,02/10/2016,93,No Negative, Location very good Staff very helpful Breakfast Excellant,8.8, Leisure trip,2,4,2
113,2,12/15/2015,95, In our own experience First night we couldn t sleep due to an extreme hot problem caused by the AC The next day we were moved to a better room ok but I was expecting to be refund for the night without proper sleep and we didn t AC was very noisy also in the new room And last At reception you will be told that reserving a taxi to the airport will cost 44Euro After doing so the taxi driver eventually charged us 55 Euro The driver simply said not responsible for promises from the hotel reception Be aware of that if you wanna use taxi from Arena, Staff was vey pleasant The place is very well designed,5.8, Leisure trip,2,4,3
114,2,10/30/2015,95, At first glance it looks like a dream hotel But then when you go see the hotel renovated and under construction which was not mentioned to us in advance Importantly they did not hear the construction work but ideally they indicate the presence of this order Even the room itself looked like dreams a room with two floors first floor shower toilet living room and a small refrigerator upstairs bedroom But at night when you go to sleep it becomes a nightmare room The doors of the rooms slammed shut and all entry and exit from different sound intensity in our room There really bad in this hotel because of the noise of slamming doors In addition the room may flooring and also hear every footstep in the room above you and from you Clean room we had not exchanged towels for 3 days until we asked , The best thing at this price excellent price in relation to the modern and spacious room received ,6.7, Leisure trip,2,4,5
115,2,07/04/2017,96,No Negative, This hotel is being renovated with great care and with an appreciation for its unique structure and location My spacious and comfortable room had a large double paned glass window onto the lush greenery of the park The breakfast selection was spectacular All considered this was a great hotel for the price and I plan to return ,9.2, Business trip,1,4,1
116,2,6/24/2017,96, Very long check in process, Impressive venue,7.9, Business trip,1,4,1
117,2,8/28/2016,96, Need to do narrow stairs to reach the room, Huge bath with big bathtub,8.3, Business trip,1,4,3
118,2,10/23/2015,116, next to a larger construction site shocking at first sight but not noisy or disturbing at least not during my stay, friendly staff place is very clean and charming beautiful restaurant and bar food looked I didn t try it way better than the usual Amsterdam culinary sins,9.2, Leisure trip,1,4,1
119,2,02/06/2017,121, The place is completely mismanaged The property is amazing and whoever is running the place is doing it a disservice Don t stay here if you are expecting a 4 star experience it s a 4 star location with 1 star service The restaurant service is the worst I have ever experienced The staff need guidance on how to serve efficiently The hotel has many strange design choices too Had a double bedroom with a friend yet you can easily see into the bathroom shower and toilet Shower overflows all over bathroom quickly You can see into the urinals from the reception area Loud security doors right outside our room woke us up regularly Put the security measures on the elevators ya goofs This is the only negative review I have ever written but the place has potential and needs new management , The property is beautiful,4.6, Leisure trip,4,3,7
120,2,9/25/2015,123,No Negative, We stayed at the hotel for 5 nights Hotel is a bit far from the center but with the tram and metro you arrive at the center in minutes Hotel is situated in a quite area The rooms are very spacious comfortable and cosy The staff is very nice and helpful,9.6, Leisure trip,2,4,4
121,2,6/29/2017,137,No Negative, Public areas are lovely and the room was nice but the window was broken and the drains in the bathroom smelt Its an old building and clearly has old building issues ,7.1, Business trip,4,4,2
122,2,05/09/2017,137, Please see above, The hotel is going through renovations and unfortunately it means that the rooms can be less than perfect However the staff did recognise those shortcomings and did everything they could to make the stay as agreeable as possible ,6.7, Leisure trip,3,4,2
