id,hotel_id,date,national_id,negative_review,positive_review,score,trip_type,guests_composition_id,room_type_id,vacation_length
476,3,10/08/2015,202, It s a hotel needs little updating Continental breakfast buffet was ok hot entrees sometimes only warm often selections were gone faster than the help could replace printer to computer was inoperable the 4 days we stayed Room wi fi was so so, Location near Earls Court underground was great Newspapers and TV stations were good View of gardens was nice lots of choices in the buffet nice to have a mini fridge in the small room ,8.3, Leisure trip,2,4,4
477,3,9/16/2015,202,No Negative, Beautiful hotel great location friendly helpful staff good breakfast included in the price LOVED the help yourself Nescafe in the lobby while waiting for breakfast Thank you ,10, Leisure trip,5,5,1
478,3,4/20/2017,202, NOTHING, lOCATION WAS GREAT,8.8, Leisure trip,2,4,6
480,3,5/16/2016,202,No Negative, great staff bed was comfortable and room was super clean,10, Leisure trip,1,4,2
481,3,05/09/2016,202,No Negative, lovely garden very personable staff comfortable lounge bar area ,10, Leisure trip,4,3,4
482,3,04/05/2016,202, Room was small , Excellent breakfasts Very clean Staff was helpful ,9.6, Leisure trip,2,4,4
483,3,3/17/2016,202,No Negative, I loved the overall ambiance and convenience of this hotel The staff was very friendly and helpful ,10, Leisure trip,4,4,5
484,3,3/17/2016,202,No Negative, Nice place nice people it suited us perfectly ,10, Leisure trip,2,5,3
485,3,1/30/2016,202, Staff attitude and guiding tourist could have been better, I liked the room ,5.4, Leisure trip,5,3,2
486,3,1/17/2016,202,No Negative, Very good location near Earls Court metro stop,10, Leisure trip,1,4,7
487,3,10/25/2015,202,No Negative, Room was quiet and big enough Breakfast was great Staff very helpful and friendly We will use this hotel again ,10, Leisure trip,2,1,4
488,3,10/09/2015,202,No Negative, Staff was excellent ,8.3, Leisure trip,2,3,5
489,3,9/27/2015,202,No Negative, Responsive staff excellent room terrific breakfast and located conveniently to tube A bit pricey but service food and comfort all exceptional ,9.6, Leisure trip,2,3,4
491,4,3/21/2017,10, To say something the wardrobe in our room was very small , Everything was ok the place was very clean comfortable and the location very convenient ,9.6, Leisure trip,4,1,9
492,4,1/17/2017,13, The ends of the bath were very vertical it looked pretty but not the most comfortable for a relaxing soak after a long day but I am aware I m fussy with my baths , Location was reason for booking and was spot on Staff were all very pleasant Time was spent out and about as we were visiting friends and family so didn t use facilities or eat breakfast Room was clean and tidy with great black out curtains Check out swift and easy ,9.2, Leisure trip,2,1,2
493,4,01/09/2017,13, The fire alarm went off in the middle of the night which was a bit disorientating Pretty sure this isn t regular but there you go , Location and price so close to Christmas was awesome room upgrade on arrival was much appreciated after a long and difficult flight Staff very welcoming and attentive helped us with our bags and shopping when we checked in and out were on hand to order taxis and help It was also quiet and out of the way despite the central location ,10, Leisure trip,2,1,2
494,4,10/13/2016,13, My room was opposite the lifts and was quite noisy which wasn t ideal when trying to work Would have been good if there was a sliding door in between the entry area and bedroom so it could be closed to minimise outside sounds , Great location good size room for London with very friendly and helpful staff ,8.3, Business trip,1,1,3
495,4,9/30/2016,13, One staff member on reception was a bit trite when queried why photo ID was required for a second time after checking in earlier in the day , Great location comfortable clean room with all facilities we needed Staff generally helpful ,9.2, Leisure trip,2,1,5
496,4,9/18/2016,13,No Negative, The hotel is well located in the legal district of London and within walking distance of major city landmarks such as St Paul s Cathedral theatres and Trafalgar Square Staff were friendly and helpful ,10, Leisure trip,1,1,5
497,4,8/16/2016,13, Nothing to improve wish I could ve stayed longer , The room was really large by London standards well planned out great modern decor a balcony to sit outside on Nespresso machine Elemis toiletries friendly helpful staff very clean good location right on Fleet St Would stay again,10, Business trip,1,1,2
499,4,06/09/2016,13, Laundry dry cleaning rates Whilst service and product is excellent the cost seems much too high , Well trained knowledgeable approachable and friendly staff ,9.6, Leisure trip,2,1,5
500,4,5/19/2016,13, All good , Room was very comfortable and well appointed Attention to detail was obvious Customer service in all areas was excellent Location was central to city attractions and entertainment ,10, Leisure trip,2,1,3
501,4,1/18/2016,13,No Negative, The staff at reception were incredibly helpful The room was very comfortable with a great sized bathroom with bath tub This was the first stop in a month long trip and it was a great way to start Very central location and within easy walking distance to all attractions We have already recommended the hotel to several people in the UK Europe ,10, Leisure trip,2,1,3
502,4,01/04/2016,13,No Negative, Everyone was very welcoming room was lovely bed was the best and great location After having received a call to make sure we had organised ourselves for Christmas Day lunch we decided to have Christmas lunch at the hotel which was good value Very nice touch Thank you,10, Leisure trip,2,1,2
503,4,09/01/2016,13,No Negative, Position was excellent for our needs Not a lot of good restaurants nearby other than hotel itself ,8.3, Leisure trip,2,1,2
504,4,8/22/2016,13, The room was a little dark but it was on a lower floor , Amazing breakfast options and the staff were very friendly and helpful,9.6, Leisure trip,1,1,4
505,4,02/03/2016,13,No Negative, the room the staff,9.2, Leisure trip,2,1,4
506,4,10/18/2015,13, Location as there wasn t much around , It was comfortable,7.1, Business trip,1,1,4
507,4,10/11/2015,14, Only one european style 220 Volt electricity plug however Adapter would have been available , Beautiful spacious rooms with moden design but in a cosy way Very fast check in and check out Beautiful spot very quiet ,9.6, Business trip,1,1,1
508,4,10/30/2016,21, Maybe a bit more choice for the breakfast but you already have eggs as you want them , Excellent bedding mattress and pillows Room large and very quiet in the upper floors as requested Staff extremely service minded and helpful Wonderful location we took the tube from St Pancras Int l to Temple when arriving However we discovered afterwards that the double decker bus 23 stops a few meters from the hotel and goes to the Strand Trafalgar Piccadilly Oxford Circus etc i e ideal for shopping theatres and activities It was also very easy to go back to St Pancras walking north on Fetter Lane to Holborn then taking bus 45 to King s Cross next to St Pancras Int l ,10, Leisure trip,2,1,2
510,4,7/28/2016,21, Access to the bar was difficult as there were some corporate events Understandable considering the quality of the hotel so not really a low point just a minor inconvenience, Amazing service great staff The rooms were great and all of my requests were met and exceeded Deco is beautiful and location extremely convenient I appreciated the peace and quiet of the location,9.6, Business trip,5,1,2
511,4,12/26/2015,21, I think the price is to much although it is not more expensive then other hotels in the city,No Positive,9.2, Leisure trip,2,1,2
512,4,12/08/2015,21,No Negative, Space and quality of bed,9.2, Leisure trip,1,1,2
513,4,4/25/2016,29,No Negative, Rooms are comfortable spacious and bathroom was very clean ,9.2, Leisure trip,2,1,3
514,4,10/20/2015,32, The only drawback no parking But there is a public car park 15 minutes walk from the hotel In the preliminary correspondence with the hotel we received very polite and detailed instructions on how to find parking Special thanks to the staff for it , Liked everything Very comfortable hotel extremely friendly staff comfortable room Breakfast is excellent 10 15 minutes walk to Trafalgar Square ,9.6, Business trip,1,3,1
516,4,12/14/2015,36,No Negative, The hotel is in a very central location but tucked away quite discreetly so it feels private The room was very comfortable no sound carried over from the rooms or hallways allowing us a decent night of sleep The bathroom was beautifully luxurious and clean We also had a drink in the hotel bar which was very good ,10, Leisure trip,2,1,1
517,4,8/13/2016,36, quality and taste of food at the restaurant was ordinary ,No Positive,7.1, Leisure trip,2,1,3
518,4,11/10/2015,36,No Negative, Really well designed and furnished bedrooms Very helpful staff who took every opportunity to assist,8.8, Leisure trip,2,1,3
519,4,12/28/2016,50, Breakfast not a value for money , Ideal location Staff very helpful Quite luxurious hotel I would say ,8.3, Leisure trip,4,1,3
520,4,04/01/2016,50, The room was extremely cold when we arrived late in the night , Very neat nice and comfortable ,9.2, Business trip,2,1,1
521,4,4/26/2016,53, Very expensive breakfast , Very clean and high comfort room and no noice from the street Very large bathroom with everything ,9.6, Leisure trip,2,1,3
522,4,09/03/2015,53,No Negative, Awesome hotel direct on my preferred list of London hotels to stay at ,10, Business trip,1,1,1
523,4,8/15/2015,53, the right elevator is in the need of maintenance, location,7.1, Leisure trip,2,1,2
524,4,02/01/2016,67, the water boiler for preparing the tea was in a cabinet When we moved on the table to prepare the tea outside the cabinet the fire alarm went on The personnel recommended us to always boil the water in the cabinet , Breakfast was good and worth the money personnel gave us 25 discount every morning ,9.6, Leisure trip,2,1,4
525,4,01/09/2017,68, We got a room 542 with a very disappointing view we were looking right into the balconies of other rooms the room itself did not have a balcony Especially in summer you won t have much privacy Location Temple is very central but still I would chose another central location the next time I m in London as in the weekends Temple seems a bit deserted , Room was very spacious and clean with all the facilities that you need Bed was very comfortable as well The surroundings is very quiet as the hotel has a innercourt and is not directly situated on a busy road,8.3, Leisure trip,2,1,2
526,4,10/09/2016,68, Room facing a wall , This hotel is located on the western edge of the City in the walking distance from all the West end attractions in a quiet courtyard next to the Temple Inn of court The room was spacious and well equipped ,9.2, Leisure trip,1,1,1
527,4,2/25/2016,68, too expensive for me most of the time , I love this place The only hotel I have found in this part of London where I am treated as an individual Amazing friendly service you feel you could ask what you want and the staff would try and help,9.6, Business trip,5,1,4
529,4,10/17/2015,68,No Negative, Staff very very friendly,9.6, Leisure trip,4,3,1
530,4,8/30/2015,68, poor wifi quality and if I m being really picky noisy airconditioning , lovely quiet setting nice breakfast good service great gym,9.2, Business trip,1,1,4
531,4,5/14/2017,74, The staff is quite annoying and could be more discreet entering the room without invitation The view from the hotel was quite uninspiring , Easy to reach Covent Garden Soho and City However the hotel is quite far away from Westminster Room is clean comfy and nicely designed Very nice couch good bath,8.3, Leisure trip,2,1,3
532,4,2/24/2017,74,No Negative, I spend the weekend in the Apex Hotel with my boyfriend and we had an an wonderful weekend the stuff from Apex was so friendly and they made everything possible have a great birthday weekend in london For this THANK YOU SO MUCH We will come back Best regards Theresa,10, Leisure trip,2,1,2
533,4,02/07/2017,74, its just really really cheap furnished no seating possibility except ONE office chair in the room nothing comfortable it is MINIMalistic furnished which would be ok in a way but you just don t feel home there Glad I just booked it for one night to try a new place since I am frequently traveling to London and was searching for a place closer to our office in Fleetstreet, location would have been great,5.8, Business trip,1,1,1
534,4,07/06/2016,74, They gave me the barrier free room which was not as comfortable as expected View on a wracked street corner so I felt a bit disappointed in view of the rather high price ,No Positive,7.5, Leisure trip,1,1,1
535,4,02/06/2017,74,No Negative, Perfect location nice and clean Hotel Highly recommended ,10, Leisure trip,2,1,3
536,4,01/07/2017,74,No Negative, Very good location yet quiet hotel,7.9, Business trip,1,1,3
537,4,04/11/2016,74, Breakfast should be included at these prices , Great location quiet helpful staff clean comfortable nice bar ,9.6, Leisure trip,2,1,2
538,4,3/29/2016,82,No Negative, The hotelw as good value for money with lots of added extras like Flemish products ,8.8, Leisure trip,2,1,3
539,4,10/19/2015,82,No Negative, An extremely good hotel lovely room and very nice and helpful staff The best room we have stayed in at a London hotel ,10, Leisure trip,2,1,3
541,4,10/27/2015,87,No Negative, Very good location close to city centre and Thameslink railway spacious rooms nice bathroom and a lot of extra features The breakfast was also very delicious The staff is friendly and helpful ,9.6, Leisure trip,1,1,3
542,4,09/07/2015,87, The grubsrew that secures the tap faucet to the Tap mixer unit was missing and was only discovered to be missing when the tap was used and water pressure then pushed the faucet off the mixer tap base this was reported to reception on Sat Sun and Monday morning still no fix before check out amusing the first time you flood the bathroom and take a cold shower More amusing when the second time it is not you who gets wet Definitely not amusing when it happens a third time because maintenance cannot fix the faucet only push it back on , An excellent hotel with a great location Apart from a tap malfunction in the main bathroom everything was great A special mention to the concierge who managed to secure us tickets for the theatre at very short notice The Master suite was very roomy and very tasteful I would not hesitate to stay here when I am next again in London ,10, Leisure trip,2,2,3
544,4,11/24/2015,89, inhouse restaurant isnt that great, location good rooms,9.6, Leisure trip,4,1,1
545,4,08/02/2017,93, Air con not great , Great location and very comfortable rooms Room was available for early check in Easy walk to attractions and trains for onward journey ,8.3, Leisure trip,2,1,1
546,4,5/25/2017,93, Nothing, Brilliant location so close to the tube Room was GORGEOUS and spacious lovely and modern The hotel was quiet and so so clean Loved it Really made our stay extra relaxing ,10, Leisure trip,2,1,2
547,4,1/16/2017,93,No Negative, Location of the hotel is fantastic The hotel itself has a lovely atmosphere and the staff are very helpful The room was massive particularly considering its location in London The breakfast had a great selection and was perfect to prepare for a long day walking around London ,10, Leisure trip,2,1,1
548,4,12/10/2016,93, I realise that good accommodation is expensive in central London but neverthelessI feel this hotel is somewhat costly We were on a room only rate so I cannot comment on the breakfasts or dinners but breakfasts are readily available within a short stroll of the hotel , The location is unbeatable both from the point of view of access to all the sites and attractions of central London but also the area where the hotel is located is very attractive The hotel is quite The staff were very friendly facilities in the bedroom and bathroom were first class ,8.8, Leisure trip,2,1,4
549,4,8/16/2016,93, Staff in reception not helpful nore friendly Besides we had to wait 30 minutes to get a drink at the bar the waiter never came we had to go to the bar Poor service compared to the hotel ranking, excellent location great bedroom especially the bed,7.1, Leisure trip,2,1,2
550,4,08/08/2016,93, area very quiet on weekends some shops closed as financial area but still only 10 15 mins walk to convent garden only issue with the room was that it was a few minutes walk from reception get a room on the side above the reception , very modern comfy rooms very clean lovely staff good wifi ok location good breakfast not included with room price ,9.2, Leisure trip,2,1,2
551,4,03/01/2016,93, Too hot everywhere Air conditioning system in the bedroom was difficult to manage tried to set it at 19 degrees but it seemed to jump back to 24 , Everything,9.6, Leisure trip,4,1,2
553,4,04/05/2017,93, Breakfast was expensive, We were given a complementary upgrade on arrival which was very much appreciated ,8.8, Leisure trip,2,3,3
554,4,01/09/2017,93, Nothing to report , The bed was amazing Hotel was spotless and staff were super ,8.8, Leisure trip,2,1,2
555,4,3/15/2016,93, Coffee too weak , Comfortable beds good toiletries superb food and service ,10, Business trip,4,3,3
556,4,2/23/2016,93, No Hairdryer in room and no free pringles as described on mini bar form, Location,8.8, Leisure trip,2,1,2
557,4,10/29/2015,93, None, Perfect location perfect weekend away,10, Leisure trip,2,1,3
558,4,08/11/2015,93,No Negative, The location the staff were excellent The hotel was very clean and comfortable ,10, Leisure trip,2,1,3
559,4,04/07/2017,94,No Negative, Bed comfy lovely shower and room,10, Leisure trip,4,1,2
560,4,10/06/2016,95, I was disappointed that there no sofa or armchir in the room as depicts in the room description The view offices 5 meter from my window The price of room service, The location The friendly staff The comfort and cleanliness of the room The bathroom The hotel s design The inner court and the lovely bar area,9.2, Leisure trip,2,1,7
561,4,08/02/2016,95, Breakfast wasn t included , The location was great both for walking or taking the tube The hotel was modern ,8.8, Leisure trip,2,1,3
562,4,1/21/2016,95, Capuccino, Location clean,9.6, Business trip,1,1,3
563,4,5/24/2017,96,No Negative, Nice dinner with a good selection of wines by the glass ,9.6, Business trip,1,1,1
564,4,02/12/2016,96,No Negative, Amazing staff and impeccable structure not a single flaw special thanks to Ben He could not have ben kinder and more attentive to our requests ,10, Leisure trip,4,3,2
565,4,12/06/2016,100,No Negative, Good location,10, Business trip,1,1,1
566,4,12/06/2016,100, The room was a little dark, The bed was very comfortable and the bathroom very spacious,9.2, Leisure trip,2,1,2
567,4,06/01/2016,100,No Negative, This is an excellent hotel in terms of its facilities The breakfast was very good ,10, Business trip,1,1,1
568,4,12/01/2015,100, No Parking, Modern hotel with excellent facilities Bathroom was fab ,8.3, Leisure trip,2,1,1
569,4,7/20/2016,101, Location for me but it is still very central , Hotels in London are always very low quality This one really manages to come in a different higher standard ,9.6, Leisure trip,1,1,2
570,4,9/20/2016,116, a bit noisy, the rooms and the breakfast and the confort,8.3, Leisure trip,2,1,2
571,4,08/08/2016,116, , excellent staff very clean and very quit room and the location is almost perfect My next stay in London will also be in this hotel ,9.2, Leisure trip,2,1,2
572,4,2/20/2017,137, Breakfast is good but quite expensive particularly if you compare it to prices of breakfast to go on Fleet Street , Rooms are quiet Beds are huge Bathroom is spacious and shower is hot and powerful Location is very good Thames within walking distance Temple area is beautiful Note however that during weekends the atmosphere is different than during week days due to the fact that many shops most of the business centres and the criminal courts are closed which results in less people in the neighbourhoud ,7.9, Business trip,2,1,3
573,4,12/22/2016,137,No Negative, Everything excellent hotel year in year out It is our fourth time there in four years the quality is constantly top ,9.6, Business trip,2,1,5
574,4,12/13/2016,137, breakfast too expensive poor coffee, very nice room modern design comfortable,10, Leisure trip,2,1,3
575,4,04/05/2016,137, No complaints , Room arrangement friendliness and helpfulness of staff and the location location location ,9.6, Leisure trip,2,1,4
576,4,03/06/2016,137,No Negative, Great hotel on a short distance from tube Extreme friendly staff Beautiful rooms tastefully decorated ,9.6, Leisure trip,2,1,3
578,4,9/13/2016,139, Room could have been a little larger but this is London , Good location comfortable bed excellent breakfast ,9.2, Leisure trip,1,1,1
579,4,04/02/2016,142,No Negative, excellent staff clean quiet very good location,10, Leisure trip,5,1,3
580,4,8/24/2016,151, The really long and winding corridor leading to my room being a single person it was a bit spooky walking to the room late in the evening , Lovely hotel with super clean rooms efficient staff and all that you may need for a comfortable and pleasant stay The room was of a fair size with comfortable bed the only drawback was no possibility of opening the window but this is a minor thing as most people prefer the air conditioning anyway Overall a great place ,9.6, Business trip,1,1,1
581,4,05/07/2017,151,No Negative, Nice modern premises friendly staff good gym,8.8, Leisure trip,2,1,3
582,4,6/20/2017,152, everything was good, the view and the windows from the 5th floor to London are very nice,9.6, Leisure trip,2,1,2
584,4,3/14/2017,156, Hard to find something wrong Breakfast not included in price, Very comfortable bed well sized room very clean,9.2, Leisure trip,2,1,3
585,4,4/19/2016,156,No Negative, Great place great room ,9.6, Leisure trip,2,1,2
586,4,03/08/2016,157, There is a definite problem with the smoking ban for those who smoke one has to walk all the way through those corridors to smoke outside There has to be a better option available either a special smoking area inside the hotel or the availability of rooms for smokers , Everything was great the service the rooms location ,10, Business trip,2,1,5
587,4,07/10/2017,165, The shower did not have sufficient pressure , The staff were helpful well trained and exceedingly polite ,9.6, Leisure trip,2,1,14
588,4,3/28/2016,167,No Negative, Room is excellent All things in room are brand nw Hotel is near to City and Royal Court Very good for business trip ,9.6, Business trip,1,1,4
589,4,07/03/2017,170, It would be helpful if the hotel could provide more detailed info on how to get to the hotel from the subway station Customers shld look out for the green elephant in the doorway otherwise really difficult to find the entrance to the hotel , Guest svc manager Francesco was very helpful with our questions on places to go and ways to get there Room bed was extremely comfortable and good sized Bathroom was also a good sized bathroom with a long bath and a cute Apex duck a very cute and novel idea ,7.5, Business trip,1,1,2
590,4,3/13/2017,170, The rooms were too dark and warm After shaving I got on a plane and realized I missed half my face The bathroom mirror was placed right on top of the toilet bowl which was absolutely disgusting Another design flaw was that you had to move the toilet seat up and down in order to flush the toilet The bedroom windows were painted shut which made it awfully stuffy hot and unbearable in the room It was difficult for bad smells to escape since there was no ventilation in the room The walkway outside the hotel room stank of chemicals and the hallway looked soulless like student dormitories One should not be paying so much money for such a low standard hotel which did not even include breakfast The staff were from anywhere else but Britain which did not help make our British experience any better , It was located in a cosy corner off the street ,4.2, Leisure trip,1,1,1
591,4,08/07/2015,175,No Negative, Location of this hotel was perfect Most of the sights that I wanted to visit can be visited on foot The room was comfort Somerset House was in 7 8mit on foot Staffs were friendly ,10, Leisure trip,1,1,4
592,4,09/02/2016,175,No Negative, Everything was wonderful,10, Leisure trip,2,1,2
593,4,4/20/2017,177, Going as a family with two rooms hired in the same reservation they allocated us in two different buildings They were even unable to allocate us in different floors of the same building, The design facilities and location of the hotel WIFI and also Gym were quite convenient,10, Leisure trip,3,1,3
594,4,9/15/2015,177, There was always a long walk for restaurants shops Covent Garden area The hotel restaurant had no nice atmosphere , Very nice staff ,7.5, Leisure trip,4,1,3
595,4,2/27/2017,183, Not quite the top notch quality it was a couple of years ago Although still a very good hotel the age is slowly starting to show Carpet coming loose in the hallway wall sockets not EU compatible small things like the bottle opener in the room broken and the nice little Bose speaker have the old iPhone 4 connector , Nice bathroom with big shower and bath Quiet if you get a room on the top floors ,7.5, Leisure trip,2,1,2
596,4,12/09/2015,183,No Negative, Comfortable beds pillows and comforters Big bathroom with deep and nice bathtub AND large separate shower Luxurious bath products Fun bar Fri Sat nights ,9.2, Leisure trip,2,1,2
