id,hotel_id,date,national_id,negative_review,positive_review,score,trip_type,guests_composition_id,room_type_id,vacation_length
185,2,12/26/2015,200, The bathrooms are more like a cubical with transparent glass Not ideal if you re a fan of your own privacy Considerable renovation works were ongoing during our stay for the inconvenience we were offered a free drink at the bar I thought this was a nice gesture until I was repeatedly told I can have that drink or that one only a tea coffee or 25cl beer You might have well not bothered Hotel Arena It was more like an insult , The staff we encountered were absolutely delightful and very helpful The rooms were clean stylish and comfortable The hotel was conveniently located within walking distance of the centre of Amsterdam ,9.2, Leisure trip,2,4,4
186,2,11/29/2015,200, the building work created a bad first impression of the hotel as had to enter through a back door through building mess would expect to be notified seating in room uncomfortable as had no back rest had to sit on floor with back against settee stairs steep to go to bathroom at night was a little precarious breakfast expensive in comparison to outside restaurants , staff helpful but maybe because of building upheaval hotel history and architecture a real treat would stay again try another room and see the hotel when fully refurbished possibly have a discount due to the visit being in middle of a bulding site and not as expected when booked ,8.8, Leisure trip,2,4,4
187,2,11/14/2015,200, Room particularly bathroom was a bit dirty when we arrived We found a pair of women shoes under the bed a clear sign that the room was not properly cleaned In addition the daily cleaning was very basic Unacceptable for an hotel of this category Such a pity because everything else was great My advice to the management is more attention to details Having read the previous reviews it seems that the hotel managers don t really take comments on board Not conductive to maintain grow the business Listen to your customers please , Very beautiful building cozy room cool bar ,6.7, Leisure trip,4,4,3
188,2,10/30/2015,200, Would have been courteous to have been told that building work was going on Bar staff wearing jeans and trainers is not in keeping with 4 hotel Having to ask every day for milk for tea making in room Having to ask for towels that were not left in the room Room 304 no shelf in the shower for putting shampoo razor etc , Character of the hotel was great Location was good,6.3, Leisure trip,2,4,4
189,2,10/26/2015,200, The only negative was the noise there were building works going on at the time which we were aware of when booking our stay and which weren t a huge problem but we did find it difficult to sleep with the noise at night cause by i assume the other guests It was probably enough to put me off visiting in the future , The staff were extremely polite and helpful i honestly couldn t fault them The room itself was clean and comfortable and the location was great ,7.9, Leisure trip,2,4,4
190,2,10/25/2015,200, Not given the room type we had booked and prepaid for No on site car park available despite pre booking of this Hotel was a building site so not very welcoming No privacy at all in bathroom as separated from lounge area by glass panel only Stairs to bed level steep and dangerous as no hand rail Arrived for our prepaid breakfast to be told we hadn t paid and had to show our payment receipt to prove we had ,No Positive,4.6, Leisure trip,2,4,3
191,2,8/20/2015,200, Small room in 2 levels connected by a very narrow and small steps The room in general shows a lack of maintenance walls courtains etc Very noisy room there where machines working just a few meters far from the window , The terrace lounge The building The location ,6.7, Leisure trip,2,4,3
192,2,8/18/2015,200, Rooms were not sufficiently cleaned on a daily basis i e no fresh cups provided once used toilet rolls not replaced bit embarrassing having to ask at reception for more , Very comfortable big bed Free wi fi Lovely building and interior,8.3, Leisure trip,2,4,4
194,2,4/28/2017,200, Nothing , everything ,10, Leisure trip,2,4,3
195,2,04/04/2017,200, check in time 3pm, location rooms staff,8.8, Leisure trip,2,4,2
196,2,01/04/2017,200,No Negative, comfort and cleanliness,7.9, Leisure trip,2,4,3
197,2,11/07/2016,200, Customer service and cleanliness of rooms , Unique room design beautiful place ,5.4, Leisure trip,4,3,3
198,2,10/26/2016,200,No Negative, The bed was incredible ,8.8, Leisure trip,2,4,3
199,2,8/27/2016,200, traffic noise in some rooms , great service good location for city centre good food very unusual minimalist room decor,9.6, Leisure trip,2,4,4
200,2,06/04/2016,200, It will be better once the improvement work is complete , Very comfortable bed Building full of character ,7.9, Leisure trip,4,4,3
201,2,5/21/2016,200,No Negative, The staff were lovely and the bed was huge Very accommodating and not so far from the city centre,8.8, Leisure trip,2,4,3
202,2,5/13/2016,200, Building site Surly staff Dodgy electrics Cold room, Food was ok,4.2, Business trip,1,1,7
203,2,1/22/2016,200,No Negative, Excellent staff and clean comfortable room Would stay again ,10, Leisure trip,2,4,2
204,2,01/08/2016,200,No Negative, Great service stunning hotel despite being under construction Lovely restaurant and a quiet surrounding ,10, Leisure trip,2,4,3
205,2,01/03/2016,200,No Negative, Good staff very helpful Free WIFI Nice hotel,9.2, Leisure trip,4,4,3
206,2,10/27/2015,200, The staff at the restaurant should be more attentive, Friendly and helpful staff,9.6, Leisure trip,4,4,2
207,2,09/06/2015,200, slightly out of the city walkable and had an easy tram ride , Lots of charm Nice rooms and the best bed ever ,8.8, Leisure trip,2,1,2
208,2,8/25/2015,200, The hotel was situated a little too far out of town , Lovely room taseful decor and artwork around the hotel Friendly and helpful staff ,8.3, Leisure trip,2,1,4
209,2,06/01/2016,202, The first room had steep steps to a loft bed Not practical and dangerous for someone 68 especially if he has to go to the bathroom in the night Second night had a room on one level ,No Positive,8.3, Leisure trip,2,4,4
210,2,02/04/2016,202, Breakfast was crazy expensive Location required about a 10 minute walk to the nearest subway Construction is underway for a massive expansion project so there was some noise during the day , Our room was very uniquely arranged with an impressive double headed shower and massive windows Very memorable The hotel is right next to a large nice park Staff was friendly ,9.2, Leisure trip,2,4,1
211,2,05/07/2016,202, The bathrooms only had smoked glass walls which did not provide as much privacy as we are used to The lighting in the halls was too dim , There was a lot of variety at breakfast and the fresh baked croissants were excellent The snacks in the restaurant were also very good The staff at the front desk was cheerful and helpful The bed was comfy ,8.8, Leisure trip,2,4,3
212,2,07/09/2016,202, Staff promised things they didn t deliver Room was very small bathroom cramped location generally distant , Generally clean and interestingly designed But a little worn Meanwhile there is massive renovation underway which will probably make it a much nicer hotel but in the meantime you will walk up a wooden ramp to reception and many amenities are in process The reason to stay here is that it s cheaper than other similar properties possibly because it s in renovation and also because it is off the beaten path though not in a bad neighborhood just not close to the hot spots ,6.3, Leisure trip,2,3,3
213,2,10/19/2016,202, Hotel is currently under renovation so not looking very nice from outside , nice location super helpful front desk staff ,8.8, Business trip,1,1,9
214,2,12/30/2015,202,No Negative, location and staff,9.6, Leisure trip,2,4,3
215,2,3/16/2016,202, The cleanness was quite poor A lot of dust under the bed under the furniture on top of the bed side lamps the remote control and even the plastic glasses in the bathroom were dirty Also something went wrong with the pipes of the shower a horrible smell came out at night , The staff was very nice and friendly the size of the room was really great and the style of the hotel is also very nice The bed was quite confortable ,5.8, Business trip,1,4,5
216,2,5/21/2017,202, We had 2 different rooms here and both were duplexes with identical floorplans There was very little space and the staircase was precarious with no handrail Was kind of a pain to have to go downstairs every time we needed something out of our luggage or needed to use the bathroom , The hotel itself is beautiful restaurant is very good and the adjacent park is gorgeous with beautiful birds and rabbits ,8.3, Leisure trip,2,4,3
217,2,7/26/2016,202, No Limited A C in common areas Dangerous metal ornaments on all banisters Musty smell throughout common areas Deluxe rooms very small impractical design Impractical shower design no place for soap Poor quality bed mattress Room refrigerator barely worked Food in restaurant overprices only fair quality Overall dark rundown dreary appearance, Good water pressure in shower,3.8, Business trip,2,4,5
218,2,7/29/2016,202,No Negative, The Arena was a wonderful experience The room was comfortable and beautiful I have been telling everyone about my stay ,10, Leisure trip,4,4,6
219,3,7/19/2017,13, Nothing really , We stayed at the hotel at a friend s recommendation It has great access to public transport and plenty of shops and places to eat close by Laundrette around the corner is also a bonus for long term travellers who need to freshen things up having access to the back garden was an added bonus for lovely summer evenings Would definitely stay there again ,9.6, Leisure trip,2,4,2
220,3,07/06/2017,13, The room for three people was on the small side , There was a beautiful garden at the back of the property where guests could relax in the sunshine read order a drink etc A great location very close to Earls Court restaurants and tube Good breakfast ,9.6, Leisure trip,4,5,4
221,3,5/26/2017,13,No Negative, We stay at this hotel each time we are in London in a nice quiet street just a short walk to Earls Court underground station the staff are always friendly rooms are always cleaned properly it s just a nice place to return to after a long day in London Great buffet breakfast,10, Leisure trip,2,4,3
222,3,9/29/2016,13, Don t believe there was anything we didn t like My personal choice for marmalade at breakfast wasn t available but I was able to find something else amongst the spread choices to satisfy my palate so this isn t a complaint , The hotel is incredibly handy to Earl s Court Station We loved using the garden at the rear of the hotel plus its quiet location such a bonus for enjoying a quiet G T at the end of each hectic day in London We ate breakfast daily throughout our stay in the hotel s restaurant and the freshness food quality and choices were excellent Being exhausted one night we ate dinner also in the restaurant where we chose from a limited but ample menu Must mention that we had initial fears of noise from the elevator adjacent to which our room was located There was no need to worry as we never heard a sound from it amazing We ll be using this hotel again as it suited us so well ,10, Leisure trip,2,3,3
223,3,8/16/2016,13, Air conditioning didn t cope with the really hot weather but luckily had big windows we could open to cool the room down at night , We had a fantastic stay at the K K George Very easy access to Earls Court tube which goes straight to Heathrow as well as being a great start to explore London easily Quiet street just behind the main shops and a lovely garden to have an evening drink in Room was very comfortable and well serviced Breakfast had lots of choice Really a lovely base for a holiday in London ,10, Leisure trip,5,5,4
224,3,4/26/2016,13, The restaurant changed as we were about to leave and the new menu didn t look very appealing, The room was spacious and very clean and the location meant it was incredibly easy for us to get about on the underground ,9.6, Leisure trip,4,3,5
225,3,6/24/2017,13, room could have been a little larger, clean good staff everything worked,9.2, Leisure trip,2,4,8
226,3,1/17/2017,13, nothing, good meals reasonable priced,10, Leisure trip,2,3,4
227,3,11/30/2016,13, The breakfast is no longer exceptional It used to be a drawcard but is now quite ordinary ,No Positive,5.8, Business trip,1,4,1
228,3,9/24/2016,13,No Negative, THE BEDS WERE VERY COMFORTABLE GREAT STAY,10, Leisure trip,4,5,4
229,3,5/17/2016,13,No Negative, The breakfast was excellent a lot of variety Location was fantastic ,9.2, Leisure trip,2,1,6
230,3,4/22/2016,13, Room tiny Bed pillows uncomfortable , Location Full breakfast was excellent Quiet location ,7.5, Leisure trip,2,4,4
231,3,9/20/2015,13, Small rooms , Excellent location near to Earl s Court tube station Great breakfasts ,7.9, Leisure trip,2,3,4
232,3,3/13/2017,14, the breakfast sucks in every aspect variety quality and service poor poor poor,No Positive,7.5, Business trip,1,3,3
233,3,12/12/2016,14, Rather noisy at night once party inhouse once external factors , Overall well managed hotel in excellent location with London weekend,7.5, Leisure trip,3,5,4
234,3,03/05/2016,21, Nothing at all, Everything Great location underground around the corner We had a room on the street side and it was very quiet Fantastic breakfast friendly staff beautiful room ,10, Leisure trip,4,3,2
235,3,02/01/2016,21, nothing, Very close to underground Very close to shops and restaurants Quiet location Very nice modern hotel even with a garden Breakfast was very good,10, Leisure trip,5,5,3
236,3,11/07/2015,21, Nothing , The hotel is situated in a quiet neighbourhood and is close to the underground station of Earls Court Very friendly staff Delicious breakfast ,10, Leisure trip,5,5,3
237,3,2/13/2017,21, Much noise in the room was difficult to sleep ,No Positive,6.7, Leisure trip,2,4,3
238,3,1/14/2016,21, a bigger room would have been nicer , everything,9.6, Business trip,1,4,1
239,3,6/23/2017,36, Squeaky floors Difficult to go to the bathroom at night without waking my husband Also 4th floor our window didn t open to the outside , Clean comfy beds Beautiful gardens Excellent helpful staff ,7.1, Leisure trip,2,1,3
240,3,3/27/2017,36, The rooms are very small we had trouble fitting 2 suitcases in The price is fairly high even by London s standards and breakfast was extra , The location is excellent direct route from the airport at Heathrow The hotel is clean and modern and has basic amenities breakfast room bar The street is quiet A good hotel if travelling on business ,7.1, Leisure trip,2,4,1
241,3,02/10/2017,36, We choose to personally take our laundry to be cleaned as it was 1 10 th of the cost of what the hotel was going to charge this was very excessive The room was very warm but we managed by keeping the windows and drapes open , Staff was very friendly and helpful The location was great The room was very quiet ,10, Leisure trip,2,3,4
242,3,1/18/2017,36,No Negative, I especially liked my room s well operating walk in non slip shower and bathroom an amenity not always found in other London hotels I also liked the comfortable bed the size of room the good elevators lifts and the proximity to Earl s Court Tube buses cafes shops and ATMs ,10, Leisure trip,1,3,7
243,3,06/10/2016,36, They weren t inexpensive , The room was clean the buffet offered plenty of variety and the staff couldn t have been better Leann in particular stood out but everyone was eager to please knowledgeable and responsive,9.2, Leisure trip,2,3,6
244,3,04/09/2016,36, Wifi is hit and miss not a huge deal but it isn t great , This is an excellent hotel Location is amazing just minutes from Earl s Court tube station but so quiet you can t believe you are in the centre of the City We could easily walk to Kensington High Street Hyde Park Natural History Museum etc Excellent shower phenomenal water pressure Room was clean Bed was very comfortable Staff excellent very friendly and able to provide lots of recommendations for sights and restaurants Breakfast was very good The hotel restaurant is good too a good alternative if you are back late from a tour or too tired to go out We will be back ,10, Leisure trip,2,4,9
245,3,04/08/2016,36,No Negative, staff are always joyful and helpful we were under booked totally my fault by 1 day and on site manager extended our stay in the same room for another thanks for that and also guiding us to the pick up point for our tour of highclare castle so kind of all of your staff thanks doug pat brugger ,10, Leisure trip,2,4,8
246,3,12/13/2016,39, Housekeeping missed my room one day and although I did not make much of a fuss over it I did not get a convincing explanation I did get an apology though , English breakfast everyday was a welcome bonus Bar is not impressive but well run kudos to Mariusz who looked after me ,9.2, Business trip,1,4,5
247,3,4/17/2016,40, The toilet is slightly small though it contains everything The floor is wooden so you could hear people walking It will be noisy for people with difficulty of falling asleep But for travellers just coming to London this does not count , Unlike the small hotels around this area this one is large and well organized The location is great which is only 3 munites walk from Earl s Court underground station which means it is in a quiet street but also is so easy to get food around The room is comparatively large considering the size of the hotel rooms in London It only takes about 40 munites going from Heathrow airport to the hotel and is very suitable for people with large suitcases and arrive in London not very early I will definitely prefer this hotel next time ,9.6, Business trip,1,3,2
248,3,02/11/2016,40, nothing, most value for money staffs are very friendly and nice location is great actually i booked 3 hotels during this trip i think K K is most valuable absolutely will book again on next trip ,10, Leisure trip,1,4,3
249,3,10/28/2015,40, Nothing It s perfect , Excellent location 2 minutes to Earl s Court underground clean room and new facilities friendly staff a good variety of breakfast to choose from ,9.2, Leisure trip,1,4,2
250,3,7/26/2017,40, The room is relatively small , The Location is very near the Earl s Court Station of Piccadilly tube ,9.2, Leisure trip,3,5,3
251,3,02/12/2016,48, The bathroom was far too small for an executive room The key of my room did not work properly , Very good location nice quiet neighbourhood Friendly staff and good breakfast ,7.1, Business trip,1,1,6
252,3,2/27/2016,51,No Negative, Excellent base for short visits to London V good breakfast charming garden well maintained and equipped if small rooms Tube station 5 mins walk,9.6, Business trip,1,3,1
254,3,01/12/2017,53, , The breakfast the room especially the view of the garden Close to Earl s Court station nice neighborhood ,9.2, Leisure trip,4,3,3
255,3,12/29/2015,53, Replace carpets in hallways and rooms please , Reception staff really professional and friendly ,9.6, Leisure trip,2,4,4
256,3,3/13/2016,58, needs full upgrade to a modern 4 stars, location,6.7, Leisure trip,2,3,5
257,3,03/08/2016,58, hotel needs upgrade, the location,6.3, Business trip,2,4,1
258,3,03/09/2017,67, We needed gluten free breakfast and ordered it beforehand but the serving was not safe The toasts were but nothing else not The table was set up in the way that cross contamination was difficult to avoid Also bacon eggs and potato cakes were cooked in the same oven and served together Potato cakes had gluten including flours They seemed to have no idea what exactly it all means to serve safe gluten free food , We had gluten free breakfast They had separate toaster for gluten free breads But I can not recommend the breakfast or eating there at all for people who need to follow strict gluten free diet Otherwise I can not complain great full wide ranging and diverse breakfast I just could not eat it Still for sure I could stay there for another time and bring my husband for the breakfast Enough for a big man It was great to have opportunity to print out your boarding passes after on line check in before leaving the hotel ,7.9, Leisure trip,4,3,2
260,3,10/24/2015,67, The first room with a king size bed we got had incredibly loud floorboards and no bath we then switched rooms to a twin suite which was much more satisfactory The view many had complimented was rather underwhelming and this from the fifth floor , The place is nice and the breakfast is very good It was nice that you could open the windows to air out the room though in all honesty the room really needed that option,6.3, Leisure trip,2,1,5
261,3,04/04/2016,67, Floorcarpet alittle bit worn dusty, Breakfast location metroconnection to airport and not far from the centre Ok,8.8, Leisure trip,2,1,4
262,3,1/23/2017,68, mistake over payments and noise due to creaky floorbords Also It would ve been nice if we were told beforehand that a 60 euros deposit would be required regarding potential mini bar consumptions When we refused to comply the person in charge told us curtly that our mini bar shall be emptied fothwith , very good location restaurants and supermarkets around and the clineanliness of the hotel ,7.9, Leisure trip,3,5,2
263,3,03/04/2016,68, The bathroom is quite small but did have a tub, the location the tea kettle the cosmetics quality linens Nice neighborhood attractive bar and lobby Fitness looked small but fine staff smiling Try the Blackbird Pub in front of the station to the right,9.2, Leisure trip,2,3,3
264,3,11/24/2015,68, One of the staff at reception in the evening apparently has some issues as he was very rude to my wife The rest of the staff were pleasant and helpful , 2 minutes from Earl s Court tube Hotel has everything you would want in London Good breakfast comfortable room free wifi that works ,8.8, Leisure trip,2,1,5
265,3,03/05/2016,68, no bath, all good comfy bed and sheets etc,8.3, Business trip,1,4,1
266,3,2/25/2016,68,No Negative, the bed the breakfast friendly stuff situation ,9.2, Leisure trip,3,4,1
267,3,11/12/2016,74, The heating was not working in the room for the first two days, Very well kept hotel with a lovely garden Staff particularly friendly and professional A very nice room,9.2, Business trip,1,1,6
268,3,05/06/2016,74, Its a hit and miss with the reception staff Sometimes I got lucky with someone who s friendly and provided excellent customer service but sometimes some of them were too green and not that trained The restaurant got very busy during breakfast time so the staff could get unfriendly , I love the location and working Wi Fi,7.5, Business trip,1,4,2
269,3,3/13/2016,74, things have changed slightly under new management no sparkling wine at breakfast cheese selection reduced no more nesepresso small changes but these were nice touches that are now lacking, have stayed here before very comfortable good showers good breakfast ,9.2, Leisure trip,4,3,4
270,3,12/25/2015,74, in spite of the environmental friendly policy our towels were exchanged on the 2nd day although we had not dropped them on the floor which is an unnecessary waste of resources, very convenient location great breakfast friendly staff lovely atmosphere very comfortable beds,9.6, Leisure trip,2,3,3
271,3,12/15/2015,74, Room was small bathroom very small Breakfast room too small people had to queue every morning Coffee and tea not up to standard Breakfast buffet was good , Location was great lots of nice pubs and restaurants nearby very close to underground easy to get to from heathrow excellent bed ,8.8, Leisure trip,4,5,3
272,3,03/02/2016,74,No Negative, Very polite staff room Service,10, Business trip,1,4,5
273,3,11/15/2015,74,No Negative, Nespresso in the lobby in the morning excellent location good showers very clean room quite large for London standards ,9.6, Business trip,1,4,3
274,3,1/31/2016,77,No Negative, Very comfortable double room excellent breakfast very courteous and helpful staff very close to the Tube many good restaurants in the area walking distance ,10, Business trip,5,3,2
275,3,03/12/2017,77, Nothing to complain about, Excellent as always,10, Leisure trip,2,4,3
276,3,1/26/2016,77,No Negative, Good location nice neighbourhood ,7.9, Business trip,2,3,3
277,3,2/20/2017,82, Breakfast was ok apart from the bacon which was terrible, Good Location Friendly Staff,8.3, Leisure trip,4,3,2
278,3,10/30/2016,86, Cleaning of the hotel is a bit slow room does not get cleaned until 5pm For people who like to take some rest in the hotel during the day seems to be inconvenient , Very convenient location to transfer and restaurants and even the rooms are on ground floor it is on a quiet street and we are able to a good night rest ,7.5, Leisure trip,4,5,3
279,3,05/01/2016,86, Occasional quirky sound from the floor next door or 1 floor above quite disturbing Expensive , Good location in Earls court quiet and comfortable ,8.3, Business trip,1,1,4
280,3,08/07/2016,86, room d cor very small room and toilets , very close to underground convenient location,5.8, Leisure trip,3,4,4
281,3,11/16/2016,88, The air condition did not work for cooling down the room we were told to shut it off and open the windows which brought all sounds from streets in from police etc Our room on the 5th floor was small and the bathroom was very small about 3 m2 , Comfortable beds quality breakfast nice and helpful staff short walk to the tube,6.3, Leisure trip,3,3,3
282,3,3/31/2017,89,No Negative, Room as advertised excellent location a 2 minute walk to buses and the tube Friendly and helpful front desk staff Would love to stay here on our next London trip too ,10, Leisure trip,2,4,4
